Information for device XBOX ACC (VID=0x045E PID=0x02FE):

------------------------------
Connection Information:
------------------------------
Device current bus speed: HighSpeed
Device supports USB 1.1 specification
Device supports USB 2.0 specification
Device address: 0x000C
Current configuration value: 0x01
Number of open pipes: 8


------------------------------
Device Descriptor:
------------------------------
0x12	bLength
0x01	bDescriptorType
0x0201	bcdUSB
0x00	bDeviceClass      
0x00	bDeviceSubClass   
0x00	bDeviceProtocol   
0x40	bMaxPacketSize0   (64 bytes)
0x045E	idVendor
0x02FE	idProduct
0x0100	bcdDevice
0x01	iManufacturer   "Microsoft Inc."
0x02	iProduct        "XBOX ACC"
0x03	iSerialNumber   "390422"
0x01	bNumConfigurations

Device Qualifier Descriptor:
------------------------------
0x0A	bLength
0x06	bDescriptorType
0x0201	bcdUSB
0x00	bDeviceClass      
0x00	bDeviceSubClass   
0x00	bDeviceProtocol   
0x40	bMaxPacketSize0   (64 bytes)
0x01	bNumConfigurations 
0x00	bReserved 


-------------------------
Configuration Descriptor:
-------------------------
0x09	bLength
0x02	bDescriptorType
0x004A	wTotalLength   (74 bytes)
0x01	bNumInterfaces
0x01	bConfigurationValue
0x02	iConfiguration   "XBOX ACC"
0xA0	bmAttributes   (Bus-powered Device, Remote-Wakeup)
0xFA	bMaxPower      (500 mA)

Interface Descriptor:
------------------------------
0x09	bLength
0x04	bDescriptorType
0x00	bInterfaceNumber
0x00	bAlternateSetting
0x08	bNumEndPoints
0xFF	bInterfaceClass      (Vendor specific)
0xFF	bInterfaceSubClass   
0xFF	bInterfaceProtocol   
0x02	iInterface   "XBOX ACC"

Endpoint Descriptor:
------------------------------
0x07	bLength
0x05	bDescriptorType
0x84	bEndpointAddress  (IN endpoint 4)
0x02	bmAttributes      (Transfer: Bulk / Synch: None / Usage: Data)
0x0200	wMaxPacketSize    (512 bytes)
0x00	bInterval         

Endpoint Descriptor:
------------------------------
0x07	bLength
0x05	bDescriptorType
0x85	bEndpointAddress  (IN endpoint 5)
0x02	bmAttributes      (Transfer: Bulk / Synch: None / Usage: Data)
0x0200	wMaxPacketSize    (512 bytes)
0x00	bInterval         

Endpoint Descriptor:
------------------------------
0x07	bLength
0x05	bDescriptorType
0x08	bEndpointAddress  (OUT endpoint 8)
0x02	bmAttributes      (Transfer: Bulk / Synch: None / Usage: Data)
0x0200	wMaxPacketSize    (512 bytes)
0x00	bInterval         

Endpoint Descriptor:
------------------------------
0x07	bLength
0x05	bDescriptorType
0x04	bEndpointAddress  (OUT endpoint 4)
0x02	bmAttributes      (Transfer: Bulk / Synch: None / Usage: Data)
0x0200	wMaxPacketSize    (512 bytes)
0x00	bInterval         

Endpoint Descriptor:
------------------------------
0x07	bLength
0x05	bDescriptorType
0x05	bEndpointAddress  (OUT endpoint 5)
0x02	bmAttributes      (Transfer: Bulk / Synch: None / Usage: Data)
0x0200	wMaxPacketSize    (512 bytes)
0x00	bInterval         

Endpoint Descriptor:
------------------------------
0x07	bLength
0x05	bDescriptorType
0x06	bEndpointAddress  (OUT endpoint 6)
0x02	bmAttributes      (Transfer: Bulk / Synch: None / Usage: Data)
0x0200	wMaxPacketSize    (512 bytes)
0x00	bInterval         

Endpoint Descriptor:
------------------------------
0x07	bLength
0x05	bDescriptorType
0x07	bEndpointAddress  (OUT endpoint 7)
0x02	bmAttributes      (Transfer: Bulk / Synch: None / Usage: Data)
0x0200	wMaxPacketSize    (512 bytes)
0x00	bInterval         

Endpoint Descriptor:
------------------------------
0x07	bLength
0x05	bDescriptorType
0x09	bEndpointAddress  (OUT endpoint 9)
0x02	bmAttributes      (Transfer: Bulk / Synch: None / Usage: Data)
0x0200	wMaxPacketSize    (512 bytes)
0x00	bInterval         


-------------------------------------
Other Speed Configuration Descriptor:
-------------------------------------
0x09	bLength
0x07	bDescriptorType
0x004A	wTotalLength   (74 bytes)
0x01	bNumInterfaces
0x01	bConfigurationValue
0x02	iConfiguration   "XBOX ACC"
0xA0	bmAttributes   (Bus-powered Device, Remote-Wakeup)
0xFA	bMaxPower      (500 mA)

Interface Descriptor:
------------------------------
0x09	bLength
0x04	bDescriptorType
0x00	bInterfaceNumber
0x00	bAlternateSetting
0x08	bNumEndPoints
0xFF	bInterfaceClass      (Vendor specific)
0xFF	bInterfaceSubClass   
0xFF	bInterfaceProtocol   
0x02	iInterface   "XBOX ACC"

Endpoint Descriptor:
------------------------------
0x07	bLength
0x05	bDescriptorType
0x84	bEndpointAddress  (IN endpoint 4)
0x02	bmAttributes      (Transfer: Bulk / Synch: None / Usage: Data)
0x0040	wMaxPacketSize    (64 bytes)
0x00	bInterval         

Endpoint Descriptor:
------------------------------
0x07	bLength
0x05	bDescriptorType
0x85	bEndpointAddress  (IN endpoint 5)
0x02	bmAttributes      (Transfer: Bulk / Synch: None / Usage: Data)
0x0040	wMaxPacketSize    (64 bytes)
0x00	bInterval         

Endpoint Descriptor:
------------------------------
0x07	bLength
0x05	bDescriptorType
0x08	bEndpointAddress  (OUT endpoint 8)
0x02	bmAttributes      (Transfer: Bulk / Synch: None / Usage: Data)
0x0040	wMaxPacketSize    (64 bytes)
0x00	bInterval         

Endpoint Descriptor:
------------------------------
0x07	bLength
0x05	bDescriptorType
0x04	bEndpointAddress  (OUT endpoint 4)
0x02	bmAttributes      (Transfer: Bulk / Synch: None / Usage: Data)
0x0040	wMaxPacketSize    (64 bytes)
0x00	bInterval         

Endpoint Descriptor:
------------------------------
0x07	bLength
0x05	bDescriptorType
0x05	bEndpointAddress  (OUT endpoint 5)
0x02	bmAttributes      (Transfer: Bulk / Synch: None / Usage: Data)
0x0040	wMaxPacketSize    (64 bytes)
0x00	bInterval         

Endpoint Descriptor:
------------------------------
0x07	bLength
0x05	bDescriptorType
0x06	bEndpointAddress  (OUT endpoint 6)
0x02	bmAttributes      (Transfer: Bulk / Synch: None / Usage: Data)
0x0040	wMaxPacketSize    (64 bytes)
0x00	bInterval         

Endpoint Descriptor:
------------------------------
0x07	bLength
0x05	bDescriptorType
0x07	bEndpointAddress  (OUT endpoint 7)
0x02	bmAttributes      (Transfer: Bulk / Synch: None / Usage: Data)
0x0040	wMaxPacketSize    (64 bytes)
0x00	bInterval         

Endpoint Descriptor:
------------------------------
0x07	bLength
0x05	bDescriptorType
0x09	bEndpointAddress  (OUT endpoint 9)
0x02	bmAttributes      (Transfer: Bulk / Synch: None / Usage: Data)
0x0040	wMaxPacketSize    (64 bytes)
0x00	bInterval         

Microsoft OS Descriptor is not available. Error code: 0x0000001F


--------------------------------
String Descriptor Table
--------------------------------
Index  LANGID  String
0x00   0x0000  0x0409 
0x01   0x0409  "Microsoft Inc."
0x02   0x0409  "XBOX ACC"
0x03   0x0409  "390422"

------------------------------

Connection path for device: 
USB xHCI Compliant Host Controller
Root Hub
XBOX ACC (VID=0x045E PID=0x02FE) Port: 8

Running on: Windows 10 or greater (Build Version 19044)

Brought to you by TDD v2.17.0, Feb 23 2021, 14:04:02
