Information for device Stadia Controller (VID=0x18D1 PID=0x9400):

*** ERROR: Descriptor has errors! ***

Connection Information:
------------------------------
Device current bus speed: HighSpeed
Device supports USB 1.1 specification
Device supports USB 2.0 specification
Device address: 0x001C
Current configuration value: 0x01
Number of open pipes: 4

Device Descriptor:
------------------------------
0x12	bLength
0x01	bDescriptorType
0x0201	bcdUSB
0xEF	bDeviceClass      (Miscellaneous device)
0x02	bDeviceSubClass   
0x01	bDeviceProtocol   
0x40	bMaxPacketSize0   (64 bytes)
0x18D1	idVendor
0x9400	idProduct
0x0100	bcdDevice
0x01	iManufacturer   "Google Inc."
0x02	iProduct        "Stadia Controller"
0x03	iSerialNumber   "9B300YCAC6WMGT"
0x01	bNumConfigurations

Device Qualifier Descriptor:
------------------------------
0x80	bLength
0x06	bDescriptorType
*** ERROR: Invalid descriptor length 0x80
Hex dump: 
0x80 0x06 0x00 0x06 0x00 0x00 0x0A 0x00 0x00 0x00 
0x1A 0x00 0x60 0xEA 0x82 0x02 0x74 0xEA 0x82 0x02 
0x74 0xEA 0x82 0x02 0x00 0x00 0x00 0x00 0x00 0x00 
0x00 0x00 0x00 0x00 0x00 0x00 0x00 0x00 0x00 0x00 
0x00 0x00 0x00 0x00 0x00 0x00 0x00 0x00 0x00 0x00 
0x00 0x00 0x00 0x00 0x00 0x00 0x00 0x00 0x00 0x00 
0x00 0x00 0x00 0x00 0x00 0x00 0x00 0x00 0x00 0x00 
0x00 0x00 0x00 0x00 0x00 0x00 0x00 0x00 0x00 0x00 
0x00 0x00 0x00 0x00 0x00 0x00 0x00 0x00 0x00 0x00 
0x00 0x00 0x00 0x00 0x00 0x00 0x00 0x00 0x00 0x00 
0x00 0x00 0x00 0x00 0x00 0x00 0x00 0x00 0x00 0x00 
0x00 0x00 0x00 0x00 0x00 0x00 0x00 0x00 0x00 0x00 
0x00 0x00 0x00 0x00 0x00 0x00 0x00 0x00 

Configuration Descriptor:
------------------------------
0x09	bLength
0x02	bDescriptorType
0x0050	wTotalLength   (80 bytes)
0x02	bNumInterfaces
0x01	bConfigurationValue
0x00	iConfiguration
0x80	bmAttributes   (Bus-powered Device)
0xFA	bMaxPower      (500 mA)

Interface Association Descriptor:
------------------------------
0x08	bLength
0x0B	bDescriptorType
0x00	bFirstInterface
0x01	bInterfaceCount
0xFF	bFunctionClass      (Vendor specific)
0x00	bFunctionSubClass   
0x00	bFunctionProtocol   
0x00	iFunction

Interface Descriptor:
------------------------------
0x09	bLength
0x04	bDescriptorType
0x00	bInterfaceNumber
0x00	bAlternateSetting
0x02	bNumEndPoints
0xFF	bInterfaceClass      (Vendor specific)
0x00	bInterfaceSubClass   
0x00	bInterfaceProtocol   
0x00	iInterface

Endpoint Descriptor:
------------------------------
0x07	bLength
0x05	bDescriptorType
0x87	bEndpointAddress  (IN endpoint 7)
0x02	bmAttributes      (Transfer: Bulk / Synch: None / Usage: Data)
0x0200	wMaxPacketSize    (512 bytes)
0x00	bInterval         

Endpoint Descriptor:
------------------------------
0x07	bLength
0x05	bDescriptorType
0x07	bEndpointAddress  (OUT endpoint 7)
0x02	bmAttributes      (Transfer: Bulk / Synch: None / Usage: Data)
0x0200	wMaxPacketSize    (512 bytes)
0x00	bInterval         

Interface Association Descriptor:
------------------------------
0x08	bLength
0x0B	bDescriptorType
0x01	bFirstInterface
0x01	bInterfaceCount
0x03	bFunctionClass      (Human Interface Device Class)
0x00	bFunctionSubClass   
0x00	bFunctionProtocol   
0x00	iFunction

Interface Descriptor:
------------------------------
0x09	bLength
0x04	bDescriptorType
0x01	bInterfaceNumber
0x00	bAlternateSetting
0x02	bNumEndPoints
0x03	bInterfaceClass      (Human Interface Device Class)
0x00	bInterfaceSubClass   
0x00	bInterfaceProtocol   
0x00	iInterface

HID Descriptor:
------------------------------
0x09	bLength
0x21	bDescriptorType
0x0111	bcdHID
0x00	bCountryCode
0x01	bNumDescriptors
0x22	bDescriptorType   (Report descriptor)
0x009C	bDescriptorLength

Endpoint Descriptor:
------------------------------
0x07	bLength
0x05	bDescriptorType
0x83	bEndpointAddress  (IN endpoint 3)
0x03	bmAttributes      (Transfer: Interrupt / Synch: None / Usage: Data)
0x0040	wMaxPacketSize    (1 x 64 bytes)
0x06	bInterval         (32 microframes)

Endpoint Descriptor:
------------------------------
0x07	bLength
0x05	bDescriptorType
0x03	bEndpointAddress  (OUT endpoint 3)
0x03	bmAttributes      (Transfer: Interrupt / Synch: None / Usage: Data)
0x0040	wMaxPacketSize    (1 x 64 bytes)
0x06	bInterval         (32 microframes)

Microsoft OS Descriptor is not available. Error code: 0x0000001F

String Descriptor Table
--------------------------------
Index  LANGID  String
0x00   0x0000  0x0409 
0x01   0x0409  "Google Inc."
0x02   0x0409  "Stadia Controller"
0x03   0x0409  "9B300YCAC6WMGT"

------------------------------

Connection path for device: 
USB xHCI Compliant Host Controller
Root Hub
Stadia Controller (VID=0x18D1 PID=0x9400) Port: 1

Running on: Windows 10 or greater (Build Version 18363)

Brought to you by TDD v2.15.0, Jun  8 2020, 17:18:07
